{
  "id": "test-workflow",
  "name": "Simple Test Workflow",
  "version": "1.0.0",
  "description": "Generate token and save to file!",
  "workflow": [
    { "googleConnect":{"email":"smupitesti2001@gmail.com"}},
    {"listEmails": 
                {
                  "getFullDetails": true,
                  "maxResults": 10
                }
    },
    "log"
  ]
}