{
  "id": "server-test-workflow",
  "name": "Server Test Workflow",
  "version": "1.0.0",
  "description": "Generate token and save to file!",
  "initialState": {
    "developer": "Narcis Brindusescu"
  },
  "workflow": [
    {
      "auth": {
        "operation": "generate_token",
        "data": "test-data",
        "success?": {
          "filesystem": {
            "operation": "write",
            "path": "/tmp/workflow-token.txt",
            "content": "Token generated successfully!"
          }
        }
      }
    },
    {
      "log": {
        "message": "$.developer"
      }
    }
  ]
}